{
  "baseline_id": "kg-mnp-ontology-baseline",
  "generated_from": [
    {
      "path": "config/ontology_modules.yaml",
      "sha256": "60fabe1dfe616938ed17a3c4662ac59348e619771241c4bdb1e839ddbea9b3f1"
    },
    {
      "path": "docs/ontology/reasoner-attestation.json",
      "sha256": "8a84bdacc2c76128d80af44b7378c5b05ee3c0252df59594f76f3d9d886d7092"
    },
    {
      "path": "docs/ontology/term-inventory.csv",
      "sha256": "3c5b81c6dae163219c26d90ebf392281a83313617b03b3952f424777a5870775"
    },
    {
      "path": "ontology/catalog-v001.xml",
      "sha256": "d6e9fe3ce8c706e7c42f0116ec71eebcce6176fd29619c6e5ca26cff38007e92"
    },
    {
      "path": "ontology/kg-mnp.ttl",
      "sha256": "4f6f9365eab9935bb48c4c4f4ad03780d8b645309c3080e4a8f53e0fc931d622"
    },
    {
      "path": "ontology/mnp-account-billing.ttl",
      "sha256": "d6b910f57f374f50aab78bd2d395e6942b8eb50ddcd87793e1a8df0ffb9feabd"
    },
    {
      "path": "ontology/mnp-alignments.ttl",
      "sha256": "e0d66406c024d553cf4ecfd9ca775cebd729001ba57bf95005b7949ceacb781b"
    },
    {
      "path": "ontology/mnp-code-list.ttl",
      "sha256": "da581690236659f7304b622b6773a276b1db84321174557906382fc56f22ba6a"
    },
    {
      "path": "ontology/mnp-compliance.ttl",
      "sha256": "7c820b67a9767f58b1fd7b00b4b89e6016ab87a985687f3ed0fe6d0a9ef2755d"
    },
    {
      "path": "ontology/mnp-core.ttl",
      "sha256": "a4e638f9ee4bb502dc2227cc2158eb23eb86f8051f08896780b1ffcecf219c3c"
    },
    {
      "path": "ontology/mnp-evidence-time.ttl",
      "sha256": "7c43c985d03884ba57b475222dbe20a711aab1d7da04394907810f6a05aeee2d"
    },
    {
      "path": "ontology/mnp-identity.ttl",
      "sha256": "7c6cab926d90fa3ddf8d0c6856fd2e2dcce4511db0843d411b9b8dec02e014f1"
    },
    {
      "path": "ontology/mnp-modeling-provenance.ttl",
      "sha256": "8252667c1f35386367b7c1373aecefa508067d7341d73a04d38522cefb299c6b"
    },
    {
      "path": "ontology/mnp-process.ttl",
      "sha256": "3970ff5b06724efdf0672346be6cc9cd33e7314b4f91b7df8fa4a9a441c720f1"
    },
    {
      "path": "ontology/mnp-service-contract.ttl",
      "sha256": "b519eac7d3a1619bbbb6f838ee23c7fd1f1e59403c696a67832c646f932ec93a"
    }
  ],
  "manifest_version": "1.0",
  "ontology_module_config_hash": "60fabe1dfe616938ed17a3c4662ac59348e619771241c4bdb1e839ddbea9b3f1",
  "ontology_version": "1.0.0",
  "optional_modules": [
    {
      "code": "ALIGNMENTS",
      "file": "ontology/mnp-alignments.ttl",
      "included_in_reasoner_input": false,
      "ontology_iri": "https://yangjunjie-lin.github.io/KG-MNP-Demo/ontology/mnp-alignments",
      "source_hash": "e0d66406c024d553cf4ecfd9ca775cebd729001ba57bf95005b7949ceacb781b",
      "version_iri": "https://yangjunjie-lin.github.io/KG-MNP-Demo/ontology/1.0.0/mnp-alignments"
    }
  ],
  "reasoner_attestation_hash": "8a84bdacc2c76128d80af44b7378c5b05ee3c0252df59594f76f3d9d886d7092",
  "reasoner_input_semantic_hash": "3c5cbf49843c1f7a440c4271b69c28add6ca93bb9364b81959bceb742c638873",
  "release_source_hash": "fa6a74a5fb1e2862e04805de58c2ef67e43920a7be785b2fc370a93df1786bfc",
  "release_source_includes_optional_alignments": false,
  "root_ontology_iri": "https://yangjunjie-lin.github.io/KG-MNP-Demo/ontology/kg-mnp",
  "root_version_iri": "https://yangjunjie-lin.github.io/KG-MNP-Demo/ontology/1.0.0/kg-mnp",
  "runtime_modules": [
    {
      "code": "CORE",
      "file": "ontology/mnp-core.ttl",
      "included_in_reasoner_input": true,
      "ontology_iri": "https://yangjunjie-lin.github.io/KG-MNP-Demo/ontology/mnp-core",
      "source_hash": "a4e638f9ee4bb502dc2227cc2158eb23eb86f8051f08896780b1ffcecf219c3c",
      "version_iri": "https://yangjunjie-lin.github.io/KG-MNP-Demo/ontology/1.0.0/mnp-core"
    },
    {
      "code": "IDENTITY",
      "file": "ontology/mnp-identity.ttl",
      "included_in_reasoner_input": true,
      "ontology_iri": "https://yangjunjie-lin.github.io/KG-MNP-Demo/ontology/mnp-identity",
      "source_hash": "7c6cab926d90fa3ddf8d0c6856fd2e2dcce4511db0843d411b9b8dec02e014f1",
      "version_iri": "https://yangjunjie-lin.github.io/KG-MNP-Demo/ontology/1.0.0/mnp-identity"
    },
    {
      "code": "ACCOUNT_BILLING",
      "file": "ontology/mnp-account-billing.ttl",
      "included_in_reasoner_input": true,
      "ontology_iri": "https://yangjunjie-lin.github.io/KG-MNP-Demo/ontology/mnp-account-billing",
      "source_hash": "d6b910f57f374f50aab78bd2d395e6942b8eb50ddcd87793e1a8df0ffb9feabd",
      "version_iri": "https://yangjunjie-lin.github.io/KG-MNP-Demo/ontology/1.0.0/mnp-account-billing"
    },
    {
      "code": "SERVICE_CONTRACT",
      "file": "ontology/mnp-service-contract.ttl",
      "included_in_reasoner_input": true,
      "ontology_iri": "https://yangjunjie-lin.github.io/KG-MNP-Demo/ontology/mnp-service-contract",
      "source_hash": "b519eac7d3a1619bbbb6f838ee23c7fd1f1e59403c696a67832c646f932ec93a",
      "version_iri": "https://yangjunjie-lin.github.io/KG-MNP-Demo/ontology/1.0.0/mnp-service-contract"
    },
    {
      "code": "PROCESS",
      "file": "ontology/mnp-process.ttl",
      "included_in_reasoner_input": true,
      "ontology_iri": "https://yangjunjie-lin.github.io/KG-MNP-Demo/ontology/mnp-process",
      "source_hash": "3970ff5b06724efdf0672346be6cc9cd33e7314b4f91b7df8fa4a9a441c720f1",
      "version_iri": "https://yangjunjie-lin.github.io/KG-MNP-Demo/ontology/1.0.0/mnp-process"
    },
    {
      "code": "COMPLIANCE",
      "file": "ontology/mnp-compliance.ttl",
      "included_in_reasoner_input": true,
      "ontology_iri": "https://yangjunjie-lin.github.io/KG-MNP-Demo/ontology/mnp-compliance",
      "source_hash": "7c820b67a9767f58b1fd7b00b4b89e6016ab87a985687f3ed0fe6d0a9ef2755d",
      "version_iri": "https://yangjunjie-lin.github.io/KG-MNP-Demo/ontology/1.0.0/mnp-compliance"
    },
    {
      "code": "EVIDENCE_TIME",
      "file": "ontology/mnp-evidence-time.ttl",
      "included_in_reasoner_input": true,
      "ontology_iri": "https://yangjunjie-lin.github.io/KG-MNP-Demo/ontology/mnp-evidence-time",
      "source_hash": "7c43c985d03884ba57b475222dbe20a711aab1d7da04394907810f6a05aeee2d",
      "version_iri": "https://yangjunjie-lin.github.io/KG-MNP-Demo/ontology/1.0.0/mnp-evidence-time"
    },
    {
      "code": "MODELING_PROVENANCE",
      "file": "ontology/mnp-modeling-provenance.ttl",
      "included_in_reasoner_input": true,
      "ontology_iri": "https://yangjunjie-lin.github.io/KG-MNP-Demo/ontology/mnp-modeling-provenance",
      "source_hash": "8252667c1f35386367b7c1373aecefa508067d7341d73a04d38522cefb299c6b",
      "version_iri": "https://yangjunjie-lin.github.io/KG-MNP-Demo/ontology/1.0.0/mnp-modeling-provenance"
    },
    {
      "code": "CODE_LIST",
      "file": "ontology/mnp-code-list.ttl",
      "included_in_reasoner_input": true,
      "ontology_iri": "https://yangjunjie-lin.github.io/KG-MNP-Demo/ontology/mnp-code-list",
      "source_hash": "da581690236659f7304b622b6773a276b1db84321174557906382fc56f22ba6a",
      "version_iri": "https://yangjunjie-lin.github.io/KG-MNP-Demo/ontology/1.0.0/mnp-code-list"
    }
  ],
  "term_inventory_hash": "3c5b81c6dae163219c26d90ebf392281a83313617b03b3952f424777a5870775"
}
